organization_id,pipeline_type,content,language,references,ncbi_tax_id,scientific_name,rank,superkingdom,kingdom,phylum,class,order,family,genus,species,organization_name
1,Virome,"To date, limited information is available on cytomegalovirus (CMV) and lymphocryptovirus (LCV) from Chlorocebus monkeys. We report here high detection rates of herpesviruses in freeroaming African green monkeys (AGMs, Chlorocebus sabaeus) (26.4%, 23/87) and in captive AGMs (75%, 3/4) with respiratory disease on the Caribbean Island of St. Kitts. LCV (81.25%) was more prevalent than CMV (18.75%) in the AGMs.",PT_BR,"Mancuso DM, Gainor K, Dore KM, Gallagher CA, Beierschmitt A, Malik YS, Ghosh S. Molecular Detection and Genetic Diversity of Cytomegaloviruses and Lymphocryptoviruses in Free-Roaming and Captive African Green Monkeys (Chlorocebus sabaeus). Int J Mol Sci. 2024 Mar 14;25(6):3272. doi: 10.3390/ijms25063272. PMID: 38542246; PMCID: PMC10970604., ",3050258,Cytomegalovirus cercopithecinebeta5,Species,Viruses,Heunggongvirae,Peploviricota,Herviviricetes,Herpesvirales,Herpesviridae,Cytomegalovirus,Cytomegalovirus cercopithecinebeta5,Vars
2,Metagenomic,"O Pegivirus humano (HPgV) e um virus de RNA pertencente a familia Flaviviridae e possui um genoma de fita simples sentido positivo com aproximadamente 9400 pb. O HPgV inclui o tipo 1 (HPgV1) e o tipo 2 (HPgV2). Seu genoma e organizado de forma similar ao virus da hepatite C (HCV), semelhanca essa que fez com que o Pegivirus fosse anteriormente conhecido como virus GB tipo C (GBVC) ou virus da hepatite G (HGV) 1,2. O HPgV1 tem uma alta prevalencia global. Cerca de um sexto da populacao foi estimada como soropositiva para HPgV1, e aproximadamente 750 milhoes de pessoas tenham viremia. No entanto, a patogenicidade do HPgV1 permanece controversa. Um grande numero de estudos epidemiologicos e clinicos nao encontrou evidencias de uma associacao de infeccao por HPgV1 com quaisquer doencas clinicas conhecidas 3.",PT_BR," Chivero ET, Stapleton JT. Tropism of human pegivirus (formerly known as GB virus C/hepatitis G virus) and host immunomodulation: insights into a highly successful viral infection. J Gen Virol. 2015 Jul;96(Pt 7):1521-32. doi: 10.1099/vir.0.000086. Epub 2015 Feb 9. PMID: 25667328; PMCID: PMC5744597. tapleton JT, Foung S, Muerhoff AS, Bukh J, Simmonds P. The GB viruses: a review and proposed classification of GBV-A, GBV-C (HGV), and GBV-D in genus Pegivirus within the family Flaviviridae. J Gen Virol. 2011 Feb;92(Pt 2):233-46. doi: 10.1099/vir.0.027490-0. Epub 2010 Nov 17. PMID: 21084497; PMCID: PMC3081076. Yu Y, Wan Z, Wang JH, Yang X, Zhang C. Review of human pegivirus: Prevalence, transmission, pathogenesis, and clinical implication. Virulence. 2022 Dec;13(1):324-341. doi: 10.1080/21505594.2022.2029328. PMID: 35132924; PMCID: PMC8837232., ",3052608,Pegivirus hominis,Species,Viruses,Orthornavirae,Kitrinoviricota,Flasuviricetes,Amarillovirales,Flaviviridae,Pegivirus,Pegivirus hominis,HIAE
1,Metagenomic,"Klebsiella pneumoniae e uma causa comum de infeccoes oportunistas resistentes a antimicrobianos em pacientes hospitalizados. A especie e naturalmente resistente as penicilinas, e membros da populacao muitas vezes carregam resistencia adquirida a multiplos antimicrobianos. No entanto, o conhecimento da ecologia, estrutura populacional ou patogenicidade de K. pneumoniae e relativamente limitado. Na ultima decada, K. pneumoniae emergiu como uma grande ameaca clinica e de saude publica devido ao aumento da prevalencia de infeccoes relacionadas a assistencia a saude causadas por cepas multirresistentes que produzem βlactamases e/ou carbapenemases de espectro estendido. Um fenomeno paralelo de infeccoes graves adquiridas na comunidade causadas por K. pneumoniae 'hipervirulenta' tambem surgiu, associado a cepas que expressam fatores de virulencia adquiridos. Essas preocupacoes clinicas distintas estimularam um interesse renovado na pesquisa de K. pneumoniae e, particularmente, na aplicacao d",PT_BR,"Genômica populacional de Klebsiella pneumoniae., https://pubmed.ncbi.nlm.nih.gov/32055025/",573,Klebsiella pneumoniae,Species,Bacteria,Unknown,Pseudomonadota,Gammaproteobacteria,Enterobacterales,Enterobacteriaceae,Klebsiella,Klebsiella pneumoniae,Vars
2,Metagenomic,"Klebsiella pneumoniae e uma especie de bacteria gramnegativa, encapsulada, anaerobia facultativa em forma de bastonete. A bacteria e considerada um patogeno oportunista que afeta pacientes imunocomprometidos causando infeccoes nasocomiais. Alguns serotipos de K. pneumoniae possuem elevada virulencia capaz de afetar individuos saudaveis, desencadeando quadro de abscesso hepatico piogenico, meningite, fasciite necrosante, endoftalmite e pneumonia severa (Kamal, et al., 2017).",PT_BR,"Kamal F, Williams G, Akbar H, et al. (January 10, 2017) Klebsiella Pneumoniae Liver Abscess: a Case Report and Review of Literature. Cureus 9(1): e970., ",573,Klebsiella pneumoniae,Species,Bacteria,Unknown,Pseudomonadota,Gammaproteobacteria,Enterobacterales,Enterobacteriaceae,Klebsiella,Klebsiella pneumoniae,HIAE
1,Virome,"Klebsiella pneumoniae e um importante patogeno oportunista gramnegativo que causa uma variedade de doencas infecciosas, incluindo infeccoes do trato urinario, bacteremia, pneumonia e abscessos hepaticos. Com o surgimento de cepas multirresistentes (MDR) e hipervirulentas de K. pneumoniae ( hvKP ), a rapida disseminacao dessas cepas clinicas na geografia e particularmente preocupante. No entanto, os mecanismos detalhados de virulencia e resistencia a antibioticos em K. pneumoniae ainda nao estao muito claros. Portanto, estudar e elucidar os mecanismos patogenicos e o mecanismo de resistencia a drogas de K. pneumoniaeinfeccao sao partes importantes da pesquisa medica atual. Neste artigo, resumimos sistematicamente a virulencia, o biofilme e os mecanismos de tolerancia a antibioticos de K. pneumoniae , e exploramos a aplicacao do sequenciamento do genoma completo e da proteomica global, que fornecerao novas pistas para o tratamento clinico de K. pneumoniae .",PT_BR,"The Characteristic of Virulence, Biofilm and Antibiotic Resistance of Klebsiella pneumoniae., https://pubmed.ncbi.nlm.nih.gov/32872324/",573,Klebsiella pneumoniae,Species,Bacteria,Unknown,Pseudomonadota,Gammaproteobacteria,Enterobacterales,Enterobacteriaceae,Klebsiella,Klebsiella pneumoniae,Vars
1,Microbiome,"O genero Bifidobacterium e composto por bacterias anaerobicas grampositivas encontradas principalmente no trato gastrointestinal humano. Essas bacterias sao conhecidas por terem efeitos beneficos para a saude do hospedeiro, incluindo a producao de acidos graxos de cadeia curta e vitaminas do complexo B, alem de fortalecer o sistema imunologico.",PT_BR,"Ventura M, O’Flaherty S, Claesson MJ, Turroni F, Klaenhammer TR, van Sinderen D, O’Toole PW. Genome-scale analyses of health-promoting bacteria: probiogenomics. Nat Rev Microbiol. 2009;7(1):61-71., ",1678,Bifidobacterium,Genus,Bacteria,Unknown,Actinomycetota,Actinomycetes,Bifidobacteriales,Bifidobacteriaceae,Bifidobacterium,Unknown,Vars
2,Virome,"O Virus Parainfluenza 3 (HPIV3, Human respirovirus 3) apresenta genoma de RNA fita simples de aproximadamente 15000bp. As infeccoes do trato respiratorio causadas por HPIV3 podem ser limitadas ao trato respiratorio superior, causando resfriados, ou podem envolver tambem o trato respiratorio inferior, causando broncopneumonia, bronquiolite ou bronquite. Os sintomas geralmente se desenvolvem entre 2 e 7 dias a partir do momento da exposicao e geralmente desaparecem em 7 a 10 dias. Esses virus estao disseminados em todo o mundo e sao uma causa importante de doencas do trato respiratorio inferior em criancas, mas podem causar infeccoes tambem em adultos. Individuos com sistema imunologico comprometido podem ter casos mais graves. Sao geralmente transmitidos de uma pessoa infectada para outras atraves da tosse, espirro e/ou toque. A maioria dos adultos tem anticorpos contra a parainfluenza, mas pode contrair infeccoes repetidas (Rima et al., 2019). Atraves da tecnica empregada neste exame, foi possivel a recuperacao do genoma completo ou parcial do Virus Parainfluenza 3 (HPIV3).",PT_BR,"Rima, Bert, et al. ""ICTV virus taxonomy profile: Paramyxoviridae."" The Journal of general virology 100.12 (2019): 1593., ",11216,Human respirovirus 3,No Rank,Viruses,Orthornavirae,Negarnaviricota,Monjiviricetes,Mononegavirales,Paramyxoviridae,Respirovirus,Respirovirus pneumoniae,HIAE
2,Metagenomic,"O Virus Parainfluenza 3 (HPIV3, Human respirovirus 3) apresenta genoma de RNA fita simples de aproximadamente 15000bp. As infeccoes do trato respiratorio causadas por HPIV3 podem ser limitadas ao trato respiratorio superior, causando resfriados, ou podem envolver tambem o trato respiratorio inferior, causando broncopneumonia, bronquiolite ou bronquite. Os sintomas geralmente se desenvolvem entre 2 e 7 dias a partir do momento da exposicao e geralmente desaparecem em 7 a 10 dias. Esses virus estao disseminados em todo o mundo e sao uma causa importante de doencas do trato respiratorio inferior em criancas, mas podem causar infeccoes tambem em adultos. Individuos com sistema imunologico comprometido podem ter casos mais graves. Sao geralmente transmitidos de uma pessoa infectada para outras atraves da tosse, espirro e/ou toque. A maioria dos adultos tem anticorpos contra a parainfluenza, mas pode contrair infeccoes repetidas (Rima et al., 2019). Atraves da tecnica empregada neste exame, foi possivel a recuperacao do genoma completo ou parcial do Virus Parainfluenza 3 (HPIV3).",PT_BR,"Rima, Bert, et al. ""ICTV virus taxonomy profile: Paramyxoviridae."" The Journal of general virology 100.12 (2019): 1593., ",11216,Human respirovirus 3,No Rank,Viruses,Orthornavirae,Negarnaviricota,Monjiviricetes,Mononegavirales,Paramyxoviridae,Respirovirus,Respirovirus pneumoniae,HIAE
2,Metagenomic,"Ureaplasma parvum e uma bacteria pertencente a familia Mycoplasmataceae e faz parte do grupo de microrganismos conhecidos como micoplasmas, que sao as menores bacterias capazes de viver e se reproduzir independentemente. Essa especie e frequentemente encontrada como parte da microbiota normal do trato genitourinario humano, mas tambem pode estar associada a condicoes patologicas em determinadas circunstancias: Infeccoes genitais e urinarias, complicacoes obstetricas e neonatais e casos de infertilidade.",PT_BR,"Petri F, Gemayel F, El Zein S, Tande A, Thoendel M, Berbari E. Tiny but Nasty: A case report and a review of the literature on Ureaplasma parvum peritonitis. IDCases. 2024, ",134821,Ureaplasma parvum,Species,Bacteria,Unknown,Mycoplasmatota,Mollicutes,Mycoplasmatales,Mycoplasmataceae,Ureaplasma,Ureaplasma parvum,HIAE
1,Microbiome,"A microbiota intestinal humana fermenta os carboidratos nao digeriveis da dieta em acidos graxos de cadeia curta (SCFA). Esses produtos microbianos sao utilizados pelo hospedeiro e o propionato e o butirato, em particular, exercem uma variedade de funcoes de promocao da saude. Aqui e fornecida uma visao geral das vias metabolicas utilizadas pelos microbios intestinais para produzir esses dois SCFA a partir de carboidratos dieteticos e de aminoacidos resultantes da quebra de proteinas. Esta visao geral enfatiza o importante papel desempenhado pela alimentacao cruzada de metabolitos intermediarios (em particular lactato, succinato e 1,2propanodiol) entre diferentes bacterias intestinais. A ecofisiologia, incluindo requisitos de crescimento e respostas a fatores ambientais, das principais bacterias produtoras de propionato e butirato sao discutidas em relacao a modulacao dietetica desses metabolitos.",PT_BR,"Formation of propionate and butyrate by the human colonic microbiota., https://pubmed.ncbi.nlm.nih.gov/27928878/",186802,Eubacteriales,order,Bacteria,Unknown,Bacillota,Clostridia,Eubacteriales,Unknown,Unknown,Unknown,Vars
1,Microbiome,"The human gut microbiota ferments dietary nondigestible carbohydrates into shortchain fatty acids (SCFA). These microbial products are utilized by the host and propionate and butyrate in particular exert a range of healthpromoting functions. Here an overview of the metabolic pathways utilized by gut microbes to produce these two SCFA from dietary carbohydrates and from amino acids resulting from protein breakdown is provided. This overview emphasizes the important role played by crossfeeding of intermediary metabolites (in particular lactate, succinate and 1,2propanediol) between different gut bacteria. The ecophysiology, including growth requirements and responses to environmental factors, of major propionate and butyrate producing bacteria are discussed in relation to dietary modulation of these metabolites. A detailed understanding of SCFA metabolism by the gut microbiota is necessary to underpin effective strategies to optimize SCFA supply to the host.",EN,"Formation of propionate and butyrate by the human colonic microbiota., https://pubmed.ncbi.nlm.nih.gov/27928878/",186802,Eubacteriales,order,Bacteria,Unknown,Bacillota,Clostridia,Eubacteriales,Unknown,Unknown,Unknown,Vars
1,Virome,"O pegivirus humano (HPgV1), anteriormente conhecido como GB virus C (GBVC) ou virus da hepatite G (HGV), e um virus de RNA positivo de fita simples pertencente ao genero Pegivirus da familia Flaviviridaefamilia. E transmitida por lesoes percutaneas (IPs), sangue e/ou hemoderivados contaminados, contato sexual e transmissao vertical de mae para filho. E amplamente prevalente na populacao em geral, especialmente em grupos de alto risco. A viremia do HPgV1 e normalmente eliminada nos primeiros 12 anos de infeccao na maioria dos individuos saudaveis, mas pode persistir por periodos mais longos em individuos imunocomprometidos e/ou naqueles coinfectados por outros virus. Um grande corpo de evidencias indica que a infeccao persistente por HPgV1 tem um efeito clinico benefico em muitas doencas infecciosas, como a sindrome da imunodeficiencia adquirida (AIDS) e a hepatite C. Os efeitos beneficos parecem estar relacionados a uma reducao significativa da ativacao imune e /ou a habitacao de",PT_BR,"Revisão do pegivírus humano: prevalência, transmissão, patogênese e implicações clínicas, https://pubmed.ncbi.nlm.nih.gov/35132924/",1985356,Pegivirus C,Species,Viruses,Orthornavirae,Kitrinoviricota,Flasuviricetes,Amarillovirales,Flaviviridae,Pegivirus,Pegivirus hominis,Vars
1,Metagenomic,"To date, limited information is available on cytomegalovirus (CMV) and lymphocryptovirus (LCV) from Chlorocebus monkeys. We report here high detection rates of herpesviruses in freeroaming African green monkeys (AGMs, Chlorocebus sabaeus) (26.4%, 23/87) and in captive AGMs (75%, 3/4) with respiratory disease on the Caribbean Island of St. Kitts. LCV (81.25%) was more prevalent than CMV (18.75%) in the AGMs. Applying a bigenic PCR approach (targeting DNA polymerase (DPOL) and glycoprotein B (gB) genes), long sequences were obtained from representative AGM CMV (KNASD6) and LCV (KNAE4, N6 and R15) samples, and mixed LCV infections were identified in KNAN6 and R15.",PT_BR,"Mancuso DM, Gainor K, Dore KM, Gallagher CA, Beierschmitt A, Malik YS, Ghosh S. Molecular Detection and Genetic Diversity of Cytomegaloviruses and Lymphocryptoviruses in Free-Roaming and Captive African Green Monkeys (Chlorocebus sabaeus). Int J Mol Sci. 2024 Mar 14;25(6):3272. doi: 10.3390/ijms25063272. PMID: 38542246; PMCID: PMC10970604., ",571,Klebsiella oxytoca,Species,Bacteria,Unknown,Pseudomonadota,Gammaproteobacteria,Enterobacterales,Enterobacteriaceae,Klebsiella,Klebsiella oxytoca,Vars
1,Virome,Virus que infectam bacterias.,PT_BR,"REFERENCIAS, https://www.google.com/",463676,Rhinovirus C,Species,Viruses,Orthornavirae,Pisuviricota,Pisoniviricetes,Picornavirales,Picornaviridae,Enterovirus,Rhinovirus C,Vars
1,Metagenomic,"To date, limited information is available on cytomegalovirus (CMV) and lymphocryptovirus (LCV) from Chlorocebus monkeys. We report here high detection rates of herpesviruses in freeroaming African green monkeys (AGMs, Chlorocebus sabaeus) (26.4%, 23/87) and in captive AGMs (75%, 3/4) with respiratory disease on the Caribbean Island of St. Kitts. LCV (81.25%) was more prevalent than CMV (18.75%) in the AGMs. Applying a bigenic PCR approach (targeting DNA polymerase (DPOL) and glycoprotein B (gB) genes), long sequences were obtained from representative AGM CMV (KNASD6) and LCV (KNAE4, N6 and R15) samples, and mixed LCV infections were identified in KNAN6 and R15.",PT_BR,"Mancuso DM, Gainor K, Dore KM, Gallagher CA, Beierschmitt A, Malik YS, Ghosh S. Molecular Detection and Genetic Diversity of Cytomegaloviruses and Lymphocryptoviruses in Free-Roaming and Captive African Green Monkeys (Chlorocebus sabaeus). Int J Mol Sci. 2024 Mar 14;25(6):3272. doi: 10.3390/ijms25063272. PMID: 38542246; PMCID: PMC10970604., ",1463165,Klebsiella quasipneumoniae,Species,Bacteria,Unknown,Pseudomonadota,Gammaproteobacteria,Enterobacterales,Enterobacteriaceae,Klebsiella,Klebsiella quasipneumoniae,Vars
1,Virome,Streptococcus parasuis INTERPRETACAO,PT_BR,"Streptococcus parasuis BACTERIAS ., ",1501662,Streptococcus parasuis,Species,Bacteria,Unknown,Bacillota,Bacilli,Lactobacillales,Streptococcaceae,Streptococcus,Streptococcus parasuis,Vars
1,Virome,"O virus da Hepatite A, ou HAV, e membro do genero Hepatovirus da familia Picornaviridae. Membros desta familia apresentam genoma de RNA simplesfita sensopositivo de aproximadamente 7500 pb. HAV e o agente etiologico da Hepatite A, uma doenca com manifestacao aguda e autolimitada. Atualmente sao conhecidos 3 genotipos de HAV que infectam humanos (I, II, III), e dentre estes, varios subtipos que refletem sua moderada diversidade genetica. A maioria dos genotipos humanos sao do grupo I, sendo o genotipo IA o mais frequente no Brasil (Paula et al., 2002).Por meio da tecnica empregada neste exame, foi possivel a recuperacao do genoma parcial ou completo de um hepatovirus A.",PT_BR,"Paula, Vanessa S., et al. ""Characterization of hepatitis A virus isolates from subgenotypes IA and IB in Rio de Janeiro, Brazil."" Journal of medical virology 66.1 (2002): 22-27., ",12092,Hepatovirus A,Species,Viruses,Orthornavirae,Pisuviricota,Pisoniviricetes,Picornavirales,Picornaviridae,Hepatovirus,Hepatovirus A,Vars
1,Metagenomic,"O virus da Hepatite A, ou HAV, e membro do genero Hepatovirus da familia Picornaviridae. Membros desta familia apresentam genoma de RNA simplesfita sensopositivo de aproximadamente 7500 pb. HAV e o agente etiologico da Hepatite A, uma doenca com manifestacao aguda e autolimitada. Atualmente sao conhecidos 3 genotipos de HAV que infectam humanos (I, II, III), e dentre estes, varios subtipos que refletem sua moderada diversidade genetica. A maioria dos genotipos humanos sao do grupo I, sendo o genotipo IA o mais frequente no Brasil (Paula et al., 2002). Por meio da tecnica empregada neste exame, foi possivel a recuperacao do genoma parcial ou completo de um hepatovirus A.",PT_BR,"Paula, Vanessa S., et al. ""Characterization of hepatitis A virus isolates from subgenotypes IA and IB in Rio de Janeiro, Brazil."" Journal of medical virology 66.1 (2002): 22-27., ",12092,Hepatovirus A,Species,Viruses,Orthornavirae,Pisuviricota,Pisoniviricetes,Picornavirales,Picornaviridae,Hepatovirus,Hepatovirus A,Vars
2,Virome,"O virus da Hepatite A, ou HAV, e membro do genero Hepatovirus da familia Picornaviridae. Membros desta familia apresentam genoma de RNA simplesfita sensopositivo de aproximadamente 7500 pb. HAV e o agente etiologico da Hepatite A, uma doenca com manifestacao aguda e autolimitada. Atualmente sao conhecidos 3 genotipos de HAV que infectam humanos (I, II, III), e dentre estes, varios subtipos que refletem sua moderada diversidade genetica. A maioria dos genotipos humanos sao do grupo I, sendo o genotipo IA o mais frequente no Brasil (Paula et al., 2002). Por meio da tecnica empregada neste exame, foi possivel a recuperacao do genoma parcial ou completo de um hepatovirus A.",PT_BR,"Paula, Vanessa S., et al. ""Characterization of hepatitis A virus isolates from subgenotypes IA and IB in Rio de Janeiro, Brazil."" Journal of medical virology 66.1 (2002): 22-27., ",12092,Hepatovirus A,Species,Viruses,Orthornavirae,Pisuviricota,Pisoniviricetes,Picornavirales,Picornaviridae,Hepatovirus,Hepatovirus A,HIAE
2,Metagenomic,"O virus da Hepatite A, ou HAV, e membro do genero Hepatovirus da familia Picornaviridae. Membros desta familia apresentam genoma de RNA simplesfita sensopositivo de aproximadamente 7500 pb. HAV e o agente etiologico da Hepatite A, uma doenca com manifestacao aguda e autolimitada. Atualmente sao conhecidos 3 genotipos de HAV que infectam humanos (I, II, III), e dentre estes, varios subtipos que refletem sua moderada diversidade genetica. A maioria dos genotipos humanos sao do grupo I, sendo o genotipo IA o mais frequente no Brasil (Paula et al., 2002). Por meio da tecnica empregada neste exame, foi possivel a recuperacao do genoma parcial ou completo de um hepatovirus A.",PT_BR,"Paula, Vanessa S., et al. ""Characterization of hepatitis A virus isolates from subgenotypes IA and IB in Rio de Janeiro, Brazil."" Journal of medical virology 66.1 (2002): 22-27., ",12092,Hepatovirus A,Species,Viruses,Orthornavirae,Pisuviricota,Pisoniviricetes,Picornavirales,Picornaviridae,Hepatovirus,Hepatovirus A,HIAE
2,Metagenomic,"Corynebacterium bovis e um bacilo Gram positivo, anaerobio facultativo da familia das Corynebacteriaceae. As infeccoes de maior incidencia sao em animais e, ocasionalmente, e reportado como patogeno oportunista em humanos causando infeccoes oculares e proteticas articulares, bem como abscessos.",PT_BR,"Cheleuitte-Nieves C, Gulvik CA, McQuiston JR, Humrighouse BW, Bell ME, Villarma A, Fischetti VA, Westblade LF, Lipman NS. Genotypic differences between strains of the opportunistic pathogen <i>Corynebacterium bovis</i> isolated from humans, cows, and rodents. PLoS One. 2018 Dec 26;13(12):e0209231. doi: 10.1371/journal.pone.0209231., ",36808,Corynebacterium bovis,Species,Bacteria,Unknown,Actinomycetota,Actinomycetes,Mycobacteriales,Corynebacteriaceae,Corynebacterium,Corynebacterium bovis,HIAE
2,Virome,"Os coronavirus humanos (HCoVsOC43, HCoVs 229E, HCoVs NL63 e HCoVsHKU1) apresentam distribuicao mundial e sao responsaveis por infeccoes do trato respiratorio superior e inferior. Sao considerados a segunda causa mais comum de resfriado (Davis et al., 2018). HCoVsHKU1 e HCoVNL63 podem causar em determinados grupos de risco (criancas, idosos e pacientes imunocomprometidos) quadros de bronquiolite e pneumonia. Mais recentemente, um novo virus designado de SARSCoV2 se tornou responsavel pela pandemia mundial da sindrome respiratoria COVID19. Atraves da tecnica empregada neste exame, foi possivel a recuperacao do genoma completo ou parcial de um Coronavirus.",PT_BR,"Davis, Brian M., et al. ""Human coronaviruses and other respiratory infections in young adults on a university campus: prevalence, symptoms, and shedding."" Influenza and other respiratory viruses 12.5 (2018): 582-590., ",277944,Human coronavirus NL63,Species,Viruses,Orthornavirae,Pisuviricota,Pisoniviricetes,Nidovirales,Coronaviridae,Alphacoronavirus,Human coronavirus NL63,HIAE
2,Metagenomic,"Os coronavirus humanos (HCoVsOC43, HCoVs 229E, HCoVs NL63 e HCoVsHKU1) apresentam distribuicao mundial e sao responsaveis por infeccoes do trato respiratorio superior e inferior. Sao considerados a segunda causa mais comum de resfriado (Davis et al., 2018). O HCoVsHKU1 e HCoVNL63 podem causar em determinados grupos de risco (criancas, idosos e pacientes imunocomprometidos) quadros de bronquiolite e pneumonia. Mais recentemente, um novo virus designado de SARSCoV2 se tornou responsavel pela pandemia mundial da sindrome respiratoria COVID19.",PT_BR,"Davis, Brian M., et al. ""Human coronaviruses and other respiratory infections in young adults on a university campus: prevalence, symptoms, and shedding."" Influenza and other respiratory viruses 12.5 (2018): 582-590., ",277944,Human coronavirus NL63,Species,Viruses,Orthornavirae,Pisuviricota,Pisoniviricetes,Nidovirales,Coronaviridae,Alphacoronavirus,Human coronavirus NL63,HIAE
2,Metagenomic,"O genero Pseudomonas compreende inumeras especies de bacterias Gramnegativas nao fermentadoras de glicose. Geralmente sao bacterias oportunistas que podem ser encontradas no ambiente, alimentos e agua. Entretanto, e um dos patogenos mais comumente causadores de infeccoes relacionadas a assistencia a saude, potencialmente, podendo apresentar resistencia a diversos grupos de antimicrobianos.",PT_BR,"CDC 2023. Disponível em: https://www.cdc.gov/hai/organisms/pseudomonas.html, ",306,Pseudomonas sp.,Species,Bacteria,Unknown,Pseudomonadota,Gammaproteobacteria,Pseudomonadales,Pseudomonadaceae,Pseudomonas,Pseudomonas sp.,HIAE
2,Metagenomic,"Escherichia coli e um bacilo gramnegativo da ordem Enterobacterales e faz parte da microbiota intestinal. Algumas cepas podem ser patogenicas, causando principalmente doencas gastrointestinais, infeccao urinaria, infeccao de corrente sanguinea e sitio cirurgico.Apesar de pouco frequente, tambem pode estar associada a infeccoes osteoarticulares como espondilodiscite. Dentre os fatores de risco para essas infeccoes destacamse idade avancada, imunossupressao, diabetes mellitus, uso prolongado de corticosteroides e procedimentos cirurgicos. Este resultado deve ser correlacionado com historica epidemiologica, sinais e sintomas clinicos e demais exames laboratoriais/imagem.",PT_BR,"Referência: Syed A, Afshan R, Tserenpil G, Manasrah N, Chippi GM, Shaik Mohammed AF. Escherichia Coli Vertebral Osteomyelitis: A Case Report. Cureus. 2023 Mar 17;15(3):e36286. doi: 10.7759/cureus.36286. PMID: 37073191; PMCID: PMC10105975., ",562,Escherichia coli,Species,Bacteria,Unknown,Pseudomonadota,Gammaproteobacteria,Enterobacterales,Enterobacteriaceae,Escherichia,Escherichia coli,HIAE
